NNStreamer: Efficient and Agile Development of On-Device AI Systems,,M. Ham; J. Moon; G. Lim; J. Jung; H. Ahn; W. Song; S. Woo; P. Kapoor; D. Chae; G. Jang; Y. Ahn; J. Lee,2021,9,IEEE Conferences,10.1109/ICSE-SEIP52600.2021.00029,https://ieeexplore.ieee.org/stamp/stamp.jsp?arnumber=9402062,neural network;on-device AI;stream processing;pipe and filter architecture;open source software,"We propose NNStreamer, a software system that handles neural networks as filters of stream pipelines, applying the stream processing paradigm to deep neural network applications. A new trend with the wide-spread of deep neural network applications is on-device AI. It is to process neural networks on mobile devices or edge/IoT devices instead of cloud servers. Emerging privacy issues, data transmission costs, and operational costs signify the need for on-device AI, especially if we deploy a massive number of devices. NNStreamer efficiently handles neural networks with complex data stream pipelines on devices, significantly improving the overall performance with minimal effort. Besides, NNStreamer simplifies implementations and allows reusing off-the-shelf media filters directly, which reduces developmental costs significantly. We are already deploying NNStreamer for a wide range of products and platforms, including the Galaxy series and various consumer electronic devices. The experimental results suggest a reduction in developmental costs and enhanced performance of pipeline architectures and NNStreamer. It is an open-source project incubated by Linux Foundation AI & Data, available to the public and applicable to various hardware and software platforms.",3,42,07-May-21,07-May-21,2021 IEEE/ACM 43rd International Conference on Software Engineering: Software Engineering in Practice (ICSE-SEIP)
pyDAW: A Pragmatic CLI for Digital Audio Processing,,P. Hassaballah; M. A. . -M. Salem; H. Othman,2019,5,IEEE Conferences,10.1109/ICCES48960.2019.9068106,https://ieeexplore.ieee.org/stamp/stamp.jsp?arnumber=9068106,Digital Audio Workstations;Command Line Interface;SoX;Digital Audio Analysis;Python;Sound and music computing;Ffmpeg;Multimedia applications;software engineering,"Digital Audio Workstations (DAW) are tools for mastering and mixing audio files, in the broader context of large-scale audio processing. Among many other processes, they allow users to perform advanced processes (e.g. Mastering and Equalization) on audio files and apply a chains of audio effects (e.g. Gain, reverb) using sophisticated GUI. DAWs has proven to be a useful resource for Digital Signal Processing (DSP) tasks, and in particular for music production. While the tools are powerful and stable, utilizing tools that require a certain level of knowledge and background in music production and sound processing can be messy and error prone. We propose a solution that allows batch processing of audio file in a fast and prompt manner carrying out some of the popular digital signal processing techniques. The proposed solution, py DAW, is in the form of an open-source tool for users who cannot afford using DAWs for their cost or complexity. pyDAW is a lean Python Command Line Interface (CLI) that provides a simple interface to complement regular DAWs GUI environments, making it easier to run DAWs functionalities in a batch and simple manner.",,19,16-Apr-20,16-Apr-20,2019 45th Euromicro Conference on Software Engineering and Advanced Applications (SEAA)
Educational trends in software engineering: a systematic review study,,N. D. Acosta; M. B. Garcia; J. B. Romero; A. L. Sevillano; N. F. Paez; O. Roa,2019,3,IEEE Conferences,10.1109/CONIITI48476.2019.8960866,https://ieeexplore.ieee.org/stamp/stamp.jsp?arnumber=8960866,Course;curriculum;learning;Software engineering;teaching,"Although there is an updated knowledge's body in software engineering, even so the curricular guides must be updated periodically. This article presents a systematic review study, which addresses the need to provide suggestions regarding the issues that should be emphasized in the area of software engineering in the systems and computer engineering program at the Catholic University of Colombia. 20 themes were identified, presented in 855 selected studies and which are studied in 50 articles, at a minimum. The most studied topic is related to software design (91.5%), followed by software development in (58%), testing and software quality in (55.5%), open source software in (33.5%), software architecture (23%), web technologies (22%), agile methodologies (18.5%), software project management (16%), software development processes (12%)), C & C ++ programming language (11%), programming languages, object-oriented programming and graphical user interface (10%), Java programming language (9%), prototype-based software development in (8.5%), requirements, standards and computer-aided software engineering in (8%), mobile software and cloud services in a (7%). The results indicate the top 20 of the essential topics in a curriculum of the software engineering area.",2,21,16 jan. 2020,16 jan. 2020,2019 27th Signal Processing and Communications Applications Conference (SIU)
Design of a Mobile Application to encourage Women’s participation in STEM careers,,V. Ahumada; R. Peñabaena-Niebles; J. Salatarin; S. Amaris,2022,3,IEEE Conferences,10.1109/JICV56113.2022.9934323,https://ieeexplore.ieee.org/stamp/stamp.jsp?arnumber=9934323,design;mobile application;m-learning;stem career,"STEM careers are constantly facing challenges and changes, but currently, the main problem lies in the low participation of women worldwide. From the above mentioned, the purpose of this project was born, which seeks to solve this problem through a mobile application that motivates and develops skills and knowledge about STEM. This application has two interactive modules to obtain a more significant attraction in girls. The first is called “Motivate yourself”, which contains videos and motivational phrases to publicize the experiences of successful and empowered women who have studied STEM. On the other hand, the second module, “Learn while playing”, provides us with various interactive games that test their knowledge to enrich the girls’ learning about STEM-related topics. These modules were created based on the M-Learning method that focuses on learning through digital platforms. While for the application’s architecture, the Scrum methodology is used, which is based on fulfilling tasks with a development team for short periods called “Sprints,” using the open-source software React Native with its JavaScript programming language. After developing this application, a pilot test was implemented where the design and content were evaluated, and corrections and improvements were implemented according to the results. Finally, it was possible to create a motivational tool for adolescent girls who are often afraid of studying careers of this type, either because of a lack of knowledge or because they do not feel they have the skills to carry them out.",,15,16 nov. 2022,16 nov. 2022,2022 XII International Conference on Virtual Campus (JICV)
Research on Monitoring of Information Equipment Based on Zabbix for Power Supply Company,,Y. G. Shan; L. Chao; G. Guangjian; F. Gao,2021,4,IEEE Conferences,10.1109/ICAML54311.2021.00108,https://ieeexplore.ieee.org/stamp/stamp.jsp?arnumber=9711964,Zabbix system;architectural example;monitoring key points;deployment mode;application ideas,"In order to cope with the new challenges brought by the construction of the energy Internet to the information equipment operation and maintenance personnel of power supply companies, in this paper, combined with the current situation of power supply company informatization, an information equipment monitoring solution based on Zabbix open source architecture is proposed. Based on the Zabbix open source architecture, the first step is to design an example diagram of the Zabbix architecture. The second step is to determine the key points of monitoring and show the installation and deployment process. In the third step, we summarize the idea of applying Zabbix monitoring device configuration. The experimental results show that the method in this paper does provide an effective open source tool for the lean management of information equipment operation and maintenance.",,15,18-Feb-22,18-Feb-22,2021 3rd International Conference on Applied Machine Learning (ICAML)
Playing Planning Poker in Crowds: Human Computation of Software Effort Estimates,,M. Alhamed; T. Storer,2021,11,IEEE Conferences,10.1109/ICSE43902.2021.00014,https://ieeexplore.ieee.org/stamp/stamp.jsp?arnumber=9402047,Software effort estimation;Planning poker;Agile development;Human Computation;Augmented intelligence;Software engineering;crowdsourcing;crowd planning poker;open source,"Reliable cost effective effort estimation remains a considerable challenge for software projects. Recent work has demonstrated that the popular Planning Poker practice can produce reliable estimates when undertaken within a software team of knowledgeable domain experts. However, the process depends on the availability of experts and can be time-consuming to perform, making it impractical for large scale or open source projects that may curate many thousands of outstanding tasks. This paper reports on a full study to investigate the feasibility of using crowd workers supplied with limited information about a task to provide comparably accurate estimates using Planning Poker. We describe the design of a Crowd Planning Poker (CPP) process implemented on Amazon Mechanical Turk and the results of a substantial set of trials, involving more than 5000 crowd workers and 39 diverse software tasks. Our results show that a carefully organised and selected crowd of workers can produce effort estimates that are of similar accuracy to those of a single expert.",3,49,07-May-21,07-May-21,2021 IEEE/ACM 43rd International Conference on Software Engineering (ICSE)
"Productivity, Turnover, and Team Stability of Agile Teams in Open-Source Software Projects",,E. Scott; K. N. Charkie; D. Pfahl,2020,7,IEEE Conferences,10.1109/SEAA51224.2020.00029,https://ieeexplore.ieee.org/stamp/stamp.jsp?arnumber=9226278,Agile Software Development;Open Source;Productivity;Turnover;Team Performance,"Productivity in software development has been studied for a long time and is still a topic of interest. Many factors, ranging from team size to music listened by developers, have been studied regarding their effect on productivity. Surprisingly, little is known about how the dynamics of open-source projects that use agile practices are related to the productivity of the developer teams. Our study aims to close this gap by analyzing the productivity of open-source projects using measures that are popular in the context of agile software development. To do this, we study data from seven open-source projects and calculated both the individual velocity of developers and focus factor of teams per iteration. First, we applied statistical process control to identify iterations with out-of-control velocity and focus factor values. Then, we studied these iterations regarding four context factors that partly characterize the dynamics of open-source projects, i.e., iteration length, turnover of developers who left, turnover of new developers, and team stability index. Our results suggest that high team stability and low turnover are strongly associated with iterations showing high velocity.",8,32,16-Oct-20,16-Oct-20,2019 26th Asia-Pacific Software Engineering Conference (APSEC)
ChiselFV: A Formal Verification Framework for Chisel,,M. Xiang; Y. Li; Y. Zhao,2023,5,IEEE Conferences,10.23919/DATE56975.2023.10137221,https://ieeexplore.ieee.org/stamp/stamp.jsp?arnumber=10137221,Hardware verification;Formal methods;Hardware description language;Chisel,"Modern digital hardware is becoming ever more complex. And agile development, an efficient idea in software development, has been introduced into hardware. Furthermore, as a new hardware construction language, Chisel helps to raise the level of hardware design abstraction with the support of object-oriented and functional programming. Chisel plays a crucial role in future hardware design and open-source hardware development. However, the formal verification for Chisel is still limited. In this paper, we propose ChiselFV, a formal verification framework that has supported detailed formal hardware property descriptions and integrated mature formal hardware verification flows based on SymbiYosys. It builds on top of Chisel and uses Scala to drive the verification process. Thus the framework can be seen as an extension of Chisel. ChiselFV makes it easy to verify hardware designs formally when implementing them in Chisel.",,29,2 jun. 2023,2 jun. 2023,"2023 Design, Automation & Test in Europe Conference & Exhibition (DATE)"
"A 12nm Agile-Designed SoC for Swarm-Based Perception with Heterogeneous IP Blocks, a Reconfigurable Memory Hierarchy, and an 800MHz Multi-Plane NoC",,T. Jia; P. Mantovani; M. C. Dos Santos; D. Giri; J. Zuckerman; E. J. Loscalzo; M. Cochet; K. Swaminathan; G. Tombesi; J. J. Zhang; N. Chandramoorthy; J. -D. Wellman; K. Tien; L. Carloni; K. Shepard; D. Brooks; G. -Y. Wei; P. Bose,2022,3,IEEE Conferences,10.1109/ESSCIRC55480.2022.9911456,https://ieeexplore.ieee.org/stamp/stamp.jsp?arnumber=9911456,,"This paper presents an agile-designed domain-specific SoC in 12nm CMOS for the emerging application domain of swarm-based perception. Featuring a heterogeneous tile-based architecture, the SoC was designed with an agile methodology using open-source processors and accelerators, interconnected by a multi-plane NoC. A reconfigurable memory hierarchy and a CS-GALS clocking scheme allow the SoC to run at a variety of performance/power operating points. Compared to a high-end FPGA, the presented SoC achieves 7 × performance and 62× efficiency gains for the target application domain.",3,15,20-Oct-22,20-Oct-22,ESSCIRC 2022- IEEE 48th European Solid State Circuits Conference (ESSCIRC)
ROSflight: A Lean Open-Source Research Autopilot,,J. Jackson; D. Koch; T. Henrichsen; T. McLain,2020,6,IEEE Conferences,10.1109/IROS45743.2020.9341653,https://ieeexplore.ieee.org/stamp/stamp.jsp?arnumber=9341653,,"ROSflight is a lean, open-source autopilot system developed with the primary goal of supporting the needs of researchers working with micro aerial vehicle systems. The project consists of firmware designed to run on low-cost, readily available flight controller boards, as well as ROS packages for interfacing between the flight controller and application code and for simulation. The core objectives of the project are as follows: maintain a small, easy-to-understand code base; provide high-bandwidth, low-latency communication between the flight controller and application code; provide a straightforward interface to research application code; allow for robust safety pilot integration; and enable true software-in-the-loop simulation capability.",,25,10-Feb-21,10-Feb-21,2020 IEEE 32nd Conference on Software Engineering Education and Training (CSEE&T)
(Special Topic Submission) Enabling Domain-Specific Architectures with an Open-Source Soft-Core GPGPU,,M. Brandalero; H. G. M. Hernandez; M. Veleski; M. A. Kadi; P. Rech; M. Hübner,2020,7,IEEE Conferences,10.1109/IPDPSW50202.2020.00015,https://ieeexplore.ieee.org/stamp/stamp.jsp?arnumber=9150348,general-purpose graphics processing units;open-source hardware;systems on chip;performance;reliability,"Graphics Processing Units (GPUs) have found application in a broad range of domains due to their ability to massively exploit data parallelism and thereby achieve high energy efficiency, being now referred to as General-Purpose GPUs (GPGPUs). However, with a market dominated by two or three industrial players and a lack of open-source hardware realizations and standardized GPU Instruction-Set Architectures (ISAs), the full potential of these architectures for academic research and use by small hardware development enterprises remains far from being unlocked. In this paper, we start by discussing a few exciting research directions in GPGPU architectures and the benefits of open-source Hardware realizations. Furthermore, we show how our open-source FGPU core can be used to enable overcoming these challenges and contribute to the agile development of Domain-Specific Architectures (DSAs) featuring System-on-Chip (SoC) platforms extended with adapted GPGPU cores. FGPU is described in VHDL, can be programmed in OpenCL by use of our LLVM-based compiler, and has been validated against an ARM Cortex A9 with NEON support, achieving 4 performance improvement in fixed and floating-point benchmarks.",3,40,28 jul. 2020,28 jul. 2020,2019 IEEE/ACM 41st International Conference on Software Engineering: New Ideas and Emerging Results (ICSE-NIER)
"A Comparative Study of Agile Methods, Testing Challenges, Solutions & Tool Support",,A. U. Rehman; A. Nawaz; M. T. Ali; M. Abbas,2020,4,IEEE Conferences,10.1109/ICOSST51357.2020.9332965,https://ieeexplore.ieee.org/stamp/stamp.jsp?arnumber=9332965,Agile development;Software development;Agile tools,"Agile development is conventional these days and with the passage of time software developers are rapidly moving from Waterfall to Agile development. Agile methods focus on delivering executable code quickly by increasing the responsiveness of software companies while decreasing development overhead and consider people as the strongest pillar of software development. As agile development overshadows Waterfall methodologies for software development, it comes up with some distinct challenges related to testing of such software. Our study is going to discuss the challenges this approach has stirred up. Some of the challenges are discussed in this paper with possible solutions and approaches used for resolving these challenges. Also, the tools in practice are mentioned to improve the efficiency of the process. (Abstract)",2,24,29 jan. 2021,29 jan. 2021,2020 24th International Conference Information Visualisation (IV)
"Low-Cost, Lightweight UWB Antenna Design for Humanitarian Drone-Launched GPR Surveys",,S. Badjou; D. Kutrubes; W. Montlouis,2020,2,IEEE Conferences,10.1109/GreenTech46478.2020.9289750,https://ieeexplore.ieee.org/stamp/stamp.jsp?arnumber=9289750,GPR;UWB antennas;underground imaging;UAS;drone;disaster rescue;SaR,"Drone-based GPR surveys could have a myriad of humanitarian applications, ranging from search and rescue and recovery missions after earthquakes, floods, and other natural disasters, to the detection of landmines and unexploded ordnance. We explore the feasibility of low-cost, lightweight components for the construction of drone-mounted ultrawideband (UWB) antennas and evaluate the acquisition system and software necessary to generate near real-time images in order to be effective for such GPR applications.",1,25,16-Dec-20,16-Dec-20,2020 IEEE Frontiers in Education Conference (FIE)
Bluejay: A Cross-Tooling Audit Framework For Agile Software Teams,,C. García; A. Guerrero; J. Zeitsoff; S. Korlakunta; P. Fernandez; A. Fox; A. Ruiz-Cortés,2021,5,IEEE Conferences,10.1109/ICSE-SEET52601.2021.00038,https://ieeexplore.ieee.org/stamp/stamp.jsp?arnumber=9402165,team practice;agile;team dashboard;team practice agreement,"Agile software teams are expected to follow a number of specific Team Practices (TPs) during each iteration, such as estimating the effort (""points"") required to complete user stories and coordinating the management of the codebase with the delivery of features. For software engineering instructors trying to teach such TPs to student teams, manually auditing teams if teams are following the TPs and improving over time is tedious, time-consuming and error-prone. It is even more difficult when those TPs involve two or more tools. For example, starting work on a feature in a project-management tool such as Pivotal Tracker should usually be followed relatively quickly by the creation of a feature branch on GitHub. Merging a feature branch on GitHub should usually be followed relatively quickly by deploying the new feature to a staging server for customer feedback. Few systems are designed specifically to audit such TPs, and existing ones, as far as we know, are limited to a single specific tool. We present Bluejay, an open-source extensible platform that uses the APIs of multiple tools to collect raw data, synthesize it into TP measurements, and present dashboards to audit the TPs. A key insight in Bluejay's design is that TPs can be expressed in terminology similar to that used for modeling and auditing Service Level Agreement (SLA) compliance. Bluejay therefore builds on mature tools used in that ecosystem and adapts them for describing, auditing, and reporting on TPs. Bluejay currently consumes data from five different widely-used development tools, and can be customized by connecting it to any service with a REST API. Video showcase available at governify.io/showcase/bluejay",,16,07-May-21,07-May-21,2021 IEEE/ACM 43rd International Conference on Software Engineering: Software Engineering Education and Training (ICSE-SEET)
(System)Verilog to Chisel Translation for Faster Hardware Design,,J. Bruant; P. -H. Horrein; O. Muller; T. Groléat; F. Pétrot,2020,6,IEEE Conferences,10.1109/RSP51120.2020.9244852,https://ieeexplore.ieee.org/stamp/stamp.jsp?arnumber=9244852,Hardware description languages;Agile development;EDA tool;Source code translation,"Bringing agility to hardware developments has been a long-running goal for hardware communities struggling with limitations of current hardware description languages such as (System)Verilog or VHDL. The numerous recent Hardware Construction Languages such as Chisel are providing enhanced ways to design complex hardware architectures with notable academic and industrial successes. While the latter environments are now mature and perfectly suited for brand new projects, migrating partially or entirely existing Verilog code-base proves to be a challenging and very time-consuming process. Successful migrations need to be able to leverage finely tuned existing hardware descriptions as a basis to build complex systems through simple iterations. This article introduces sv2chisel, an open-source automated (System)Verilog to Chisel translator as entry point for this iterative migration processes. Our tool achieved the proper translation, with on-par resource usage of a real-world production FPGA design at OVHcloud as well as two independent open-source Verilog projects: a MIPS core and the size-optimized 32-bit RISC-V core PicoRV32.",1,19,4 nov. 2020,4 nov. 2020,2020 12th International Conference on Information Technology and Electrical Engineering (ICITEE)
A Process to Develop Lean Big-Data Platform Architectures for Industrial Manufacturing Contexts,,M. Illian; S. Althoff; H. Karl,2020,3,IEEE Conferences,10.1109/ETFA46521.2020.9212006,https://ieeexplore.ieee.org/stamp/stamp.jsp?arnumber=9212006,Industry 4.0;Big Data Platform;Architecture;Open-Source Software,"Manufacturing companies can accomplish increased productivity by using data-driven learning methods based on production and machine data. To realise that big-data platforms are needed to simplify data provisioning and manipulation, for example to train machine learning algorithms. We introduce a method for the generation of big-data platform architectures. The method covers software selection which minimises implementation efforts and maximises the maintainability of used software solutions to implement architectures. We apply requirements from four large scale manufacturers to our method in a case study.",2,9,05-Oct-20,05-Oct-20,2019 IEEE International Conference on Software Maintenance and Evolution (ICSME)
SALSA: Self-Adjusting Lean Streaming Analytics,,R. B. Basat; G. Einziger; M. Mitzenmacher; S. Vargaftik,2021,11,IEEE Conferences,10.1109/ICDE51399.2021.00080,https://ieeexplore.ieee.org/stamp/stamp.jsp?arnumber=9458734,,"Counters are the fundamental building block of many data sketching schemes, which hash items to a small number of counters and account for collisions to provide good approximations for frequencies and other measures. Most existing methods rely on fixed-size counters, which may be wasteful in terms of space, as counters must be large enough to eliminate any risk of overflow. Instead, some solutions use small, fixed-size counters that may overflow into secondary structures.This paper takes a different approach. We propose a simple and general method called SALSA for dynamic re-sizing of counters, and show its effectiveness. SALSA starts with small counters, and overflowing counters simply merge with their neighbors. SALSA can thereby allow more counters for a given space, expanding them as necessary to represent large numbers. Our evaluation demonstrates that, at the cost of a small overhead for its merging logic, SALSA significantly improves the accuracy of popular schemes (such as Count-Min Sketch and Count Sketch) over a variety of tasks. Our code is released as open source [1].",3,46,22 jun. 2021,22 jun. 2021,2021 IEEE 37th International Conference on Data Engineering (ICDE)
