A Game Plan to Build Optimized Regression Testing in Agile Methodologies Using Test Prioritization,,N. Govil; A. Sharma,2021,3,IEEE Conferences,10.1109/ISCON52037.2021.9702479,https://ieeexplore.ieee.org/stamp/stamp.jsp?arnumber=9702479,Agile Methodologies;Automated Regression Testing;Test Prioritization;Risk-based Approach;Collaborative Approach,"Substantially, every software system is not completely bug-free. However, software industries usually apply a lot of convincing strategies to ensure the delivery of bug-free software products. Due to the iterative and incremental nature of Agile projects, testing activities are simultaneously organized by the Scrum Masters along with the routine development exercises. Regression testing is such type of testing technique that is performed to corroborate and ensure the impact of any new code in the existing modules of the software product. Proper optimization practices can reduce the efforts and time required to conduct Regression Testing. Although, it is quite challenging to optimize regression testing activities. So there is a need to implement an automotive regression testing mechanism that is based on associated risks and test prioritization to reduce the testing time and effort of testing engineers. In this research paper, we discussed the challenges and strategies to develop optimized regression testing in Agile methodologies. By adopting this mechanism, professionals can reduce their testing effort and time while developing Agile software products to a great extent.",,16,14-Feb-22,14-Feb-22,2021 5th International Conference on Information Systems and Computer Networks (ISCON)
Towards Predicting the Impact of Software Changes on Building Activities,,M. Tufano; H. Sajnani; K. Herzig,2019,3,IEEE Conferences,10.1109/ICSE-NIER.2019.00021,https://ieeexplore.ieee.org/stamp/stamp.jsp?arnumber=8805697,software building;predictive models,"The pervasive adoption of Continuous Integration practices - both in industry and open source projects - has led software building to become a daily activity for thousands of developers around the world. Companies such as Microsoft have invested in in-house infrastructures with the goal of optimizing the build process. CloudBuild, a distributed and caching build service developed internally by Microsoft, runs the build process in parallel in the cloud and relies on caching to accelerate builds. This allows for agile development and rapid delivery of software even several times a day. However, moving towards faster builds requires not only improvements on the infrastructure side, but also attention to developers' changes in the software. Surely, architectural decisions and software changes, such as addition of dependencies, can lead to significant build time increase. Yet, estimating the impact of such changes on build time can be challenging when dealing with complex, distributed, and cached build systems. In this paper, we envision a predictive model able to preemptively alert developers on the extent to which their software changes may impact future building activities. In particular, we describe an approach that analyzes the developer's change and predicts (i) whether it impacts (any of) the Longest Critical Path; (ii) may lead to build time increase and its delta; and (iii) the percentage of future builds that might be affected by such change.",8,10,22-Aug-19,22-Aug-19,2019 IEEE International Conference on Software Maintenance and Evolution (ICSME)
A Mixed Reality Teaching Course for Formal Higher Education,,B. Hensen; R. Klamma,2022,4,IEEE Conferences,10.23919/iLRN55037.2022.9815961,https://ieeexplore.ieee.org/stamp/stamp.jsp?arnumber=9815961,mixed reality;augmented reality;education;curriculum;workplace training,"The advancements of mixed reality technologies enable a productive application of mixed reality in various fields. This increases the demand for skilled mixed reality developers. Current curricula do not offer dedicated mixed reality courses in higher education that provide the necessary competences. We demonstrate a lab course for mixed reality software engineering in a bachelor program at a technical university with its learning goals and the identified skills to support future mixed reality computer scientists. The course was conducted five times over two and a half years with a total of 38 students. In all instances, the same open-source software project was used as a boundary object to train agile software engineering, mixed reality development competences, and presentation skills. As the course teaches state-of-the-art agile workflows, its aim is to prepare students for scientific projects, a bachelor thesis and industry training scenarios in mixed reality.",,15,11 jul. 2022,11 jul. 2022,2022 8th International Conference of the Immersive Learning Research Network (iLRN)
Work in Progress: Development of a web-based educational robotics learning monitoring system using free software,,J. Galindo-Losada; C. Balcazar; M. Carrión-Toro; M. Santórum,2023,3,IEEE Conferences,10.1109/EDUNINE57531.2023.10102878,https://ieeexplore.ieee.org/stamp/stamp.jsp?arnumber=10102878,framework;web application;monitoring;emotions;usability;robotics;assessment;free software,"Educational robotics encompasses the integration of robotics into educational processes for educational purposes. An example of educational robotics is Lego Education WeDo 2.0, whose workshops include Exploration, Creation, and Sharing phases. Students build and design robots based on instructions to achieve goals. However, all the gathered information of the students during the workshops is not stored and published in a web system. Thus, workshop information is not delivered to teachers in a web manner to monitor students' learning. Since this, a web-based system has been developed to track such experiences. It allows the monitoring and control of student performance at each stage of the learning process based on a non-intrusive method to capture information, such as detecting emotions through a webcam. A Scrum methodology is used, which allows user stories definition. Usability assessment with 17 experts shows an overall score of 88.30 percent.",,13,21-Apr-23,21-Apr-23,2023 IEEE World Engineering Education Conference (EDUNINE)
Learning to Identify Security-Related Issues Using Convolutional Neural Networks,,D. N. Palacio; D. McCrystal; K. Moran; C. Bernal-Cárdenas; D. Poshyvanyk; C. Shenefiel,2019,4,IEEE Conferences,10.1109/ICSME.2019.00024,https://ieeexplore.ieee.org/stamp/stamp.jsp?arnumber=8919098,deep learning;cnn;security issues;sdl,"Software security is becoming a high priority for both large companies and start-ups alike due to the increasing potential for harm that vulnerabilities and breaches carry with them. However, attaining robust security assurance while delivering features requires a precarious balancing act in the context of agile development practices. One path forward to help aid development teams in securing their software products is through the design and development of security-focused automation. Ergo, we present a novel approach, called SecureReqNet, for automatically identifying whether issues in software issue tracking systems describe security-related content. Our approach consists of a two-phase neural net architecture that operates purely on the natural language descriptions of issues. The first phase of our approach learns high dimensional word embeddings from hundreds of thousands of vulnerability descriptions listed in the CVE database and issue descriptions extracted from open source projects. The second phase then utilizes the semantic ontology represented by these embeddings to train a convolutional neural network capable of predicting whether a given issue is security-related. We evaluated SecureReqNet by applying it to identify security-related issues from a dataset of thousands of issues mined from popular projects on GitLab and GitHub. In addition, we also applied our approach to identify security-related requirements from a commercial software project developed by a major telecommunication company. Our preliminary results are encouraging, with SecureReqNet achieving an accuracy of 96% on open source issues and 71.6% on industrial requirements.",11,24,05-Dec-19,05-Dec-19,2020 IEEE Green Technologies Conference(GreenTech)
An open-source framework for cross-platform testing in agile projects,,I. Yanjari; B. Marín; G. Giachetti,2022,7,IEEE Conferences,10.1109/SCCC57464.2022.10000346,https://ieeexplore.ieee.org/stamp/stamp.jsp?arnumber=10000346,Testing;Framework;Agile Methodologies;BDD;Cross-Platform;Acceptance test cases,"Agile methodologies have become popular in the software development industry because they improve the interaction among stakeholders, developers and project managers by achieving development results through shorter delivery times. One of the main problem with agile methodologies is the quality and the quantity of testing tasks to be performed, which in many cases are focused on unitary testing. This causes different issues for agile projects at the integration of sub-systems or the acceptance of the products developed. Continuous integration (CI) technique is commonly used to avoid some integration problems because it improves the validation of the software products by means of the automatic execution of different test cases at the moment of updating a software product located in a version control platform. Nevertheless, these test cases are manly focused on unitary testing and they are created for specific platforms. This paper presents an open source framework to improve continuous integration in order to execute acceptance test cases automatically. In particular, we use Behavioral Driven Development (BDD) to create the test cases that can be used with web and mobile drivers for different platforms. The framework proposed has been evaluated obtaining promising results.",,12,4 jan. 2023,4 jan. 2023,2022 41st International Conference of the Chilean Computer Science Society (SCCC)
When You Have More Satellites than People: The Evolution of CYGNSS Flight Operations,,R. Medina; J. Redfern; W. Wells; E. Birath; D. Lamb; A. Alexander; T. Ewing,2019,10,IEEE Conferences,10.1109/AERO.2019.8741926,https://ieeexplore.ieee.org/stamp/stamp.jsp?arnumber=8741926,,"The flight operations of the Cyclone Global Navigation Satellite System (CYGNSS), a constellation of eight microsatellites built and operated by Southwest Research Institute (SwRI), designed to improve the intensity forecasts of Tropical Cyclones, has seen a litany of changes to its concept of operations, software, processes, and personnel. In this paper, we detail how the operations team responded to several challenges such as the reduction in personnel after the Launch and Early Orbit Operations phase, the addition of a downlink antenna in Japan, high-fidelity collection requests during the unusually active 2017 Atlantic hurricane season, and the increased demands of team members from other projects. These pressures forced the CYGNSS operations team to innovate their way to efficient operations. These innovations were enabled by embracing modern open-source tools such as Django, Bokeh, Git, the various libraries available in the Python programming language, and the capabilities that come with all of our operations engineers being competent in software development. The CYGNSS team took the approach of automating the most time-intensive tasks first, which freed up time to carefully design and test more elaborate automation solutions. We utilized the spirit of the Agile Methodology to make incremental improvements to our software suite which further enabled more sophisticated automation. Finally, we chart a path forward to fully closing the automation loop between our mission planning, and real-time Command and Control.",,7,20 jun. 2019,20 jun. 2019,2020 International Workshop on Rapid System Prototyping (RSP)
Continuous Testing in the Development of IoT Applications,,L. G. Guşeilă; D. -V. Bratu; S. -A. Moraru,2019,5,IEEE Conferences,10.1109/ISSI47111.2019.9043692,https://ieeexplore.ieee.org/stamp/stamp.jsp?arnumber=9043692,IoT;Cloud Computing;Agile Development;DevOps;Continuous Integration;Continuous Development;Continuous Testing;Automated Testing,"Internet-of-Things has evolved with the increased volume of data of interconnecting the physical world to the Internet. Cloud provides the underlying power for IoT to become a disrupting technology, revolutionizing the cloud, as we know it. IoT applications need to adapt frequently and rapidly to new requests. Increasing competition and rapidly changing market needs require from nowadays companies' flexibility and fast time to market of their products. To achieve these goals more and more organizations are relying on new IT technologies and software development processes. Though there are many publications around DevOps as a methodology and the use of a process for continuous integration and continuous development, there are fewer solutions provided which incorporate a software delivery pipeline incorporating all processes: continuous business planning, agile development, continuous integration, continuous deployment and continuous testing. The paper proposes a DevOps architecture and agile tools to be used in the implementation of a fully integrated DevOps pipeline based on open-source. Furthermore, continuous testing is covering test best practices and methods, which along with the DevOps pipeline can be widely implemented in any cloud environment, regardless of the cloud provider chosen.",1,13,23 mar. 2020,23 mar. 2020,2020 25th IEEE International Conference on Emerging Technologies and Factory Automation (ETFA)
One Block on Top of the Other: Using Minetest to Teach Scrum,,J. -P. Steghöfer; H. Burden,2022,10,IEEE Conferences,10.1145/3510456.3514157,https://ieeexplore.ieee.org/stamp/stamp.jsp?arnumber=9794186,• Software and its engineering → Agile software development;;• Social and professional topics → Adult education.,"Teaching Scrum using Lego has been an established teaching technique for years. However, the COVID-19 pandemic forced teachers all over the globe to rethink this valuable teaching tool. In this experience report, we show how we transferred our version of a Lego Scrum workshop into the world of Minetest, an open-source variant of Minecraft. We detail our reasoning, the concrete technical and pedagogical challenges, as well as experiences and reflections from the students, us as teachers, our peers, and theoretical frameworks. Finally, we share our materials to enable other teachers to use this new tool.",,66,13 jun. 2022,13 jun. 2022,2022 IEEE/ACM 44th International Conference on Software Engineering: Software Engineering Education and Training (ICSE-SEET)
Qualifying Software Engineers Undergraduates in DevOps - Challenges of Introducing Technical and Non-technical Concepts in a Project-oriented Course,,I. Alves; C. Rocha,2021,9,IEEE Conferences,10.1109/ICSE-SEET52601.2021.00024,https://ieeexplore.ieee.org/stamp/stamp.jsp?arnumber=9402207,DevOps;education;Open-source;OSS;FOSS;Empirical-software-engineering;Agile-software-development;Emerging-domains-of-software;Tools-and-environments,"he constant changes in the software industry, practices, and methodologies impose challenges to teaching and learning current software engineering concepts and skills. DevOps is particularly challenging because it covers technical concepts, such as pipeline automation, and non-technical ones, such as team roles and project management. The present study investigates a course setup to introduce these concepts to software engineering undergraduates. We designed the course by employing coding to associate DevOps concepts to Agile, Lean, and Open source practices and tools. We present the main aspects of this project-oriented DevOps course, with 240 students enrolled it since its first offering in 2016. We conducted an empirical study, with both a quantitative and qualitative analysis, to evaluate this project-oriented course setup. We collected the data from the projects repository and students' perceptions from a questionnaire. We mined 148 repositories (corresponding to 72 projects) and obtained 86 valid responses to the questionnaire. We also mapped the concepts which are more challenging to students learn from experience. The results evidence that first-hand experience facilitates the comprehension of DevOps concepts and enriches classes discussions. we present a set of lessons learned, which may help professors better design and conduct project-oriented courses to cover DevOps concepts.",3,34,07-May-21,07-May-21,2021 IEEE/ACM 43rd International Conference on Software Engineering: Software Engineering Education and Training (ICSE-SEET)
Investigating the Effectiveness of Clustering for Story Point Estimation,,V. Tawosi; A. Al-Subaihin; F. Sarro,2022,11,IEEE Conferences,10.1109/SANER53432.2022.00101,https://ieeexplore.ieee.org/stamp/stamp.jsp?arnumber=9825830,Software Effort Estimation;Story Point Estimation;Latent Dirichlet Allocation;Hierarchical Clustering,"Automated techniques to estimate Story Points (SP) for user stories in agile software development came to the fore a decade ago. Yet, the state-of-the-art estimation techniques' accuracy has room for improvement. In this paper, we present a new approach for SP estimation, based on analysing textual features of software issues by employing latent Dirichlet allocation (LDA) and clustering. We first use LDA to represent issue reports in a new space of generated topics. We then use hierarchical clustering to agglomerate issues into clusters based on their topic similarities. Next, we build estimation models using the issues in each cluster. Then, we find the closest cluster to the new coming issue and use the model from that cluster to estimate the SP. Our approach is evaluated on a dataset of 26 open source projects with a total of 31,960 issues and compared against both baselines and state-of-the-art SP estimation techniques. The results show that the estimation performance of our proposed approach is as good as the state-of-the-art. However, none of these approaches is statistically significantly better than more naive estimators in all cases, which does not justify their additional complexity. We therefore encourage future work to develop alternative strategies for story points estimation. The experimental data and scripts we used in this work are publicly available to allow for replication and extension.",1,52,21 jul. 2022,21 jul. 2022,"2022 IEEE International Conference on Software Analysis, Evolution and Reengineering (SANER)"
Machine Learning-based Estimation of Story Points in Agile Development: Industrial Experience and Lessons Learned,,M. Abadeer; M. Sabetzadeh,2021,9,IEEE Conferences,10.1109/REW53955.2021.00022,https://ieeexplore.ieee.org/stamp/stamp.jsp?arnumber=9582288,Agile Development;Story-point Estimation;Machine Learning,"Estimating story points is an important activity in agile software engineering. Story-point estimation enables software development teams to, among other things, better scope products, prioritize requirements, allocate resources and measure progress. Several machine learning techniques have been proposed for automated story-point estimation. However, most of these techniques use open-source projects for evaluation. There are important differences between open-source and commercial projects with respect to story authoring. The goal of this paper is to evaluate a state-of-the-art machine learning technique, known as Deep-SE [3], for estimating story points in a commercial project. Our dataset is comprised of 4,727 stories for a data anonymization product developed by a 27-member agile team at a healthcare data science company, IQVIA. Over this dataset, Deep-SE achieved a mean absolute error of 1.46, significantly better than three different baselines. Model performance nonetheless varied across stories, with the estimation error being larger for stories that had higher points. Our results further indicate that model performance is correlated with certain story characteristics such as the level of detail and the frequency of vague terms in the stories. An important take-away from our study is that, before organizations attempt to introduce machine learning-based estimation into agile development, they need to better embrace agile best practices, particularly in relation to story authoring and expert-based estimation.",2,23,27-Oct-21,27-Oct-21,2021 IEEE 29th International Requirements Engineering Conference Workshops (REW)
Assessing the Risk of Software Development in Agile Methodologies Using Simulation,,M. I. Lunesu; R. Tonelli; L. Marchesi; M. Marchesi,2021,18,IEEE Journals,10.1109/ACCESS.2021.3115941,https://ieeexplore.ieee.org/stamp/stamp.jsp?arnumber=9548910,Effort estimation error;random issue allocation;risk analysis;software process simulation;Agile;simulation;Monte Carlo methods;software development management,"Agile methodologies aim to reduce software development risk using short iterations, feature-driven development, continuous integration, testing automation, and other practices. However, the risk of project failure or time and budget overruns is still a relevant problem. This paper aims to present and discuss a new approach to model some key risk factors in agile development, using software process simulation modeling (SPSM), which can complement other approaches, and whose usage is particularly suited for agile development. We introduce a new approach to modeling some key risk factors – namely project duration, number of implemented issues, and key statistics of issue completion time – using a simulator of agile development, which we developed for this purpose. The approach includes modeling the agile process, gathering data from the tool used for project management, and performing Monte Carlo simulations of the process, to get insights about the expected time and effort to complete the project, and about their distributions. The model’s parameters that can cause risk are errors in effort estimation of the features to develop, variations in developers’ assignment to these features, impediments related to developers’ availability and work completion. To validate the simulator, and to demonstrate how the method can be used, we analyzed three open-source projects, gathering their data from JIRA repositories. We ran Monte Carlo simulations of these projects, showing that the simulator can well approximate the progress of the real project, then varying the identified risk factors and statistically evaluating their effects on the risk parameters. The proposed approach is relevant for project managers, being able to quantitatively evaluate the risks, provided that the process and the project’s data are properly modeled and gathered. As for the future, we are working to improve our risk assessment method, evaluating it on more case studies, scaling the model from a single team to multiple teams involved in one or more projects.",2,54,27-Sep-21,05-Oct-21,IEEE Access
Hardware Data Prefetch for XiangShan Processor,,Y. Zhu; J. Zheng; S. Ding; L. Li,2022,3,IEEE Conferences,10.1109/ICICM56102.2022.10011259,https://ieeexplore.ieee.org/stamp/stamp.jsp?arnumber=10011259,prefetch;XiangShan processor;out-of-order;opensource,"XiangShan, a rising star of RISC-V-based processors proposed by Chinese Academy of Science, is famous for its high performance and agile methodology. At present, the second-generation Yanqi Lake architecture of XiangShan has already reached the frequency of 2GHz at the 14nm process node, which ranks the first in the field of open-source RISC-V-based processors. One of the key approaches that contribute to its high performance is prefetch. A timely and accurate prefetcher can effectively eliminate cache misses and thus hide memory access latency. Aiming at the specific environment of XiangShan, out-of-order and parallel, a stride-based prefetcher for the L1DCache is achieved on the Yanqi Lake structure of XiangShan. Serious benchmarks from SPEC2006 were run on XiangShan, the result of which demonstrates that our prefetcher improves the performance of XiangShan by an average of 2.5% and up to 13.3%.",,9,16 jan. 2023,16 jan. 2023,2022 7th International Conference on Integrated Circuits and Microsystems (ICICM)
